{
  "title": "TOPJUMP - PARTY INVITATION 20161003 V01",
  "outline": [
    {
      "level": "H1",
      "text": "HOPE To SEE You THERE! ",
      "page": 1
    }
  ],
  "content_sections": [
    {
      "type": "heading",
      "content": "ADDRESS:",
      "page": 1,
      "bbox": [
        32.648799896240234,
        444.2804260253906,
        104.44307708740234,
        461.3222961425781
      ],
      "level": 1
    },
    {
      "type": "heading",
      "content": "TOPJUMP  3735  PARKWAY  PIGEON FORGE, TN 37863  (NEAR DIXIE STAMPEDE  ON  THE PARKWAY)",
      "page": 1,
      "bbox": [
        58.387901306152344,
        458.4438171386719,
        270.6555480957031,
        513.7181396484375
      ],
      "level": 1
    },
    {
      "type": "heading",
      "content": "RSVP:  ----------------",
      "page": 1,
      "bbox": [
        29.48900032043457,
        523.3318481445312,
        296.8285217285156,
        549.1915283203125
      ],
      "level": 1
    },
    {
      "type": "paragraph",
      "content": "CLOSED TOED SHOES  ARE  REQUIRED FOR CLIMBING",
      "page": 1,
      "bbox": [
        62.29779815673828,
        555.747802734375,
        266.2198486328125,
        565.64306640625
      ],
      "level": 0
    },
    {
      "type": "paragraph",
      "content": "PARENTS  OR  GUARDIANS NOT ATTENDING THE PARTY,  PLEASE VISIT  TOPJUMP.COM  TO  FILL  OUT  WAIVER  SO YOUR CHILD CAN ATTEND.  HOPE  To  SEE  Y ou  T HERE !",
      "page": 1,
      "bbox": [
        33.418800354003906,
        571.8294677734375,
        306.7695617675781,
        634.962158203125
      ],
      "level": 0
    },
    {
      "type": "heading",
      "content": "WWW.TOPJUMP.COM",
      "page": 1,
      "bbox": [
        93.78669738769531,
        624.4996948242188,
        236.11007690429688,
        656.6593017578125
      ],
      "level": 2
    }
  ],
  "full_text": "ADDRESS: \nTOPJUMP \n3735 PARKWAY \nPIGEON FORGE, TN 37863 \n(NEAR DIXIE STAMPEDE ON THE PARKWAY) \nRSVP: ----------------\nCLOSED TOED SHOES ARE REQUIRED FOR CLIMBING \nPARENTS OR GUARDIANS NOT ATTENDING THE PARTY, \nPLEASE VISIT TOPJUMP.COM TO FILL OUT WAIVER \nSO YOUR CHILD CAN ATTEND. \nHOPE To SEE You THERE! \nWWW.TOPJUMP.COM",
  "tables": [],
  "form_fields": [],
  "static_form_fields": []
}