{
  "title": "Parsippany -Troy Hills STEM Pathways",
  "outline": [
    {
      "level": "H1",
      "text": "Parsippany -Troy Hills STEM Pathways",
      "page": 1
    },
    {
      "level": "H2",
      "text": "PATHWAY OPTIONS",
      "page": 1
    },
    {
      "level": "H2",
      "text": "Elective Course Offerings",
      "page": 1
    },
    {
      "level": "H2",
      "text": "What Colleges Say!",
      "page": 1
    }
  ],
  "content_sections": [
    {
      "type": "heading",
      "content": "Parsippany -Troy Hills STEM Pathways",
      "page": 1,
      "bbox": [
        125.8207015991211,
        37.369590759277344,
        562.1452026367188,
        65.37680053710938
      ],
      "level": 3
    },
    {
      "type": "heading",
      "content": "Mission Statement:\u00a0   To provide PTHSD high school students with the opportunity to  concentrate their studies, beyond those required in high school, in the areas of science,  technology, engineering, and mathematics, and expose students to relevant real world  experiences through project work, conferences and presentations to enhance their high school  experience.",
      "page": 1,
      "bbox": [
        80.32749938964844,
        88.69420623779297,
        543.8029174804688,
        163.51829528808594
      ],
      "level": 1
    },
    {
      "type": "heading",
      "content": "PATHWAY OPTIONS",
      "page": 1,
      "bbox": [
        240.17869567871094,
        438.1753845214844,
        365.1392517089844,
        457.23406982421875
      ],
      "level": 2
    },
    {
      "type": "heading",
      "content": "REGULAR PATHWAY",
      "page": 1,
      "bbox": [
        117.1802978515625,
        467.75457763671875,
        242.09622192382812,
        483.06475830078125
      ],
      "level": 2
    },
    {
      "type": "list_item",
      "content": "4 credits of Math \u25cf 4 credits of Science \u25cf 4 credits of STEM-designated electives \u25cf Maintain an overall 2.85 GPA \u25cf Participate in a minimum of 3 STEM  presentations/conferences each year  with a required minimum total of 12  presentations/conferences throughout  the 4 years . * \u25cf Join and actively participate in a  STEM-related extracurricular activity or  club every year of attendance. -",
      "page": 1,
      "bbox": [
        74.78157043457031,
        502.58599853515625,
        292.5996398925781,
        662.1925659179688
      ],
      "level": 0
    },
    {
      "type": "heading",
      "content": "DISTINCTION PATHWAY \u25cf 4 credits of Math - At least one math  course should be an AP Math class. \u25cf 4 credits of Science- At least one  science course should be an AP  Science class. \u25cf 4 credits of STEM-designated electives  - One must be a Computer  Science/Technology Class \u25cf Maintain an overall 3.5 GPA  \u25cf Participate in a minimum of 3 STEM  presentations/conferences a year with a  required minimum total of 12  presentations/conferences throughout  the 4 years. \u25cf Join and actively participate in a  STEM-related extracurricular activity or  club every year of attendance.  \u25cf Either participate in an internship or  design and implement a community  impact project.",
      "page": 1,
      "bbox": [
        320.7744140625,
        467.75457763671875,
        542.9417114257812,
        752.2532958984375
      ],
      "level": 2
    },
    {
      "type": "heading",
      "content": "Goals:",
      "page": 1,
      "bbox": [
        45.41230010986328,
        182.6382598876953,
        82.10828399658203,
        200.08251953125
      ],
      "level": 1
    },
    {
      "type": "list_item",
      "content": "Inspire keen interest in mathematics, science, engineering, and technology, develop strong scholarship in the subject and  promote the enjoyment of these studies in high school.",
      "page": 1,
      "bbox": [
        41.384498596191406,
        210.96881103515625,
        341.39996337890625,
        249.7999725341797
      ],
      "level": 0
    },
    {
      "type": "list_item",
      "content": "Expose students to potential career opportunities in the field. \u2022  Encourage students to pursue higher education and major in  STEM careers. \u2022 Promote interactions with STEM professionals to learn about  future opportunities. \u2022 Support field experiences connected to the world outside of  the school building. \u2022 Signal to employers, universities, training programs, and  military that a student has completed a comprehensive course  of study in a specialized area. \u2022 Cultivate transferable work habits such as perseverance, goal  setting, and self-direction.",
      "page": 1,
      "bbox": [
        39.682037353515625,
        251.499267578125,
        338.53399658203125,
        411.9276428222656
      ],
      "level": 0
    }
  ],
  "full_text": "Parsippany -Troy Hills STEM Pathways\nMission Statement:\u00a0 To provide PTHSD high school students with the opportunity to \nconcentrate their studies, beyond those required in high school, in the areas of science, \ntechnology, engineering, and mathematics, and expose students to relevant real world \nexperiences through project work, conferences and presentations to enhance their high school \nexperience. \nPATHWAY OPTIONS\nREGULAR PATHWAY\n\u25cf\n4 credits of Math\n\u25cf\n4 credits of Science\n\u25cf\n4 credits of STEM-designated electives\n\u25cf\nMaintain an overall 2.85 GPA\n\u25cf\nParticipate in a minimum of 3 STEM \npresentations/conferences each year \nwith a required minimum total of 12 \npresentations/conferences throughout \nthe 4 years. *\n\u25cf\nJoin and actively participate in a \nSTEM-related extracurricular activity or \nclub every year of attendance. - \nDISTINCTION PATHWAY\n\u25cf\n4 credits of Math - At least one math \ncourse should be an AP Math class.\n\u25cf\n4 credits of Science- At least one \nscience course should be an AP \nScience class.\n\u25cf\n4 credits of STEM-designated electives \n- One must be a Computer \nScience/Technology Class\n\u25cf\nMaintain an overall 3.5 GPA \n\u25cf\nParticipate in a minimum of 3 STEM \npresentations/conferences a year with a \nrequired minimum total of 12 \npresentations/conferences throughout \nthe 4 years.\n\u25cf\nJoin and actively participate in a \nSTEM-related extracurricular activity or \nclub every year of attendance. \n\u25cf\nEither participate in an internship or \ndesign and implement a community \nimpact project.\nGoals:\n\u2022 Inspire keen interest in mathematics, science, engineering, and\ntechnology, develop strong scholarship in the subject and \npromote the enjoyment of these studies in high school.\n \n\u2022 Expose students to potential career opportunities in the field.\n\u2022 Encourage students to pursue higher education and major in \nSTEM careers.\n\u2022 Promote interactions with STEM professionals to learn about \nfuture opportunities.\n\u2022 Support field experiences connected to the world outside of \nthe school building.\n\u2022 Signal to employers, universities, training programs, and \nmilitary that a student has completed a comprehensive course \nof study in a specialized area.\n\u2022 Cultivate transferable work habits such as perseverance, goal \nsetting, and self-direction.",
  "tables": [
    {
      "page": 1,
      "data": [
        [
          "Parsippany -Troy Hills STEM Pathways"
        ]
      ]
    },
    {
      "page": 1,
      "data": [
        [
          "PATHWAY OPTIONS",
          ""
        ],
        [
          "REGULAR PATHWAY\n\u25cf 4 credits of Math\n\u25cf 4 credits of Science\n\u25cf 4 credits of STEM-designated electives\n\u25cf Maintain an overall 2.85 GPA\n\u25cf Participate in a minimum of 3 STEM\npresentations/conferences each year\nwith a required minimum total of 12\npresentations/conferences throughout\nthe 4 years. *\n\u25cf Join and actively participate in a\nSTEM-related extracurricular activity or\nclub every year of attendance. -",
          "DISTINCTION PATHWAY\n\u25cf 4 credits of Math - At least one math\ncourse should be an AP Math class.\n\u25cf 4 credits of Science- At least one\nscience course should be an AP\nScience class.\n\u25cf 4 credits of STEM-designated electives\n- One must be a Computer\nScience/Technology Class\n\u25cf Maintain an overall 3.5 GPA\n\u25cf Participate in a minimum of 3 STEM\npresentations/conferences a year with a\nrequired minimum total of 12\npresentations/conferences throughout\nthe 4 years.\n\u25cf Join and actively participate in a\nSTEM-related extracurricular activity or\nclub every year of attendance.\n\u25cf Either participate in an internship or\ndesign and implement a community\nimpact project."
        ]
      ]
    },
    {
      "page": 1,
      "data": [
        [
          "REGULAR PATHWAY"
        ]
      ]
    },
    {
      "page": 1,
      "data": [
        [
          "DISTINCTION PATHWAY"
        ]
      ]
    }
  ],
  "form_fields": [],
  "static_form_fields": []
}